{
  "$schema": "./repos.v3.schema.json",
  "_schema": "git-repos-master/v3",
  "_doc": "THE ONE SOURCE of _git-repos-master (#1295). Every other file here that lists repos is GENERATED from it: repos.json (cloud-repos/v1 compat for clone.sh, cloud-drive, libs:repos, hub subsets), repos-github.json (linktree areas-gen.mjs contract), README.md (template 9_others/templates/README.md.tpl), 0_repos-tree/*, 1_repo-folders-tree/* skeleton and the farms. Run `node gen-registry.js` after an edit; `node repos-sot.js check` fails on any drift. Hierarchy: tree[] = AREA -> PROJECT -> [SUBCATEGORY] -> FAMILY -> REPO; codes are positional (area N, project N.M, ...); a node's hub repo sits in its `hub` with code <node>.0. Derived, never stored: a repo's farm (nearest `farm` up the tree), its hub / parent_hub (nearest hub up the tree), developer (nearest up), url and private.",
  "owner": "diegonmarcos",
  "icons": {
    "visibility": {
      "public": "🌐",
      "private": "🔒"
    },
    "developer": {
      "_Meta": "🗂️",
      "Leaf.y": "🍃",
      "Nexus.z": "💹",
      "Stark.x": "🔬",
      "lecole42": "🎓",
      "Projects": "🧩",
      "Gh": "🐙",
      "Z-archived": "📦"
    }
  },
  "root": {
    "code": "0",
    "kind": "hub",
    "name": "_git-repos-master",
    "label": "repo_master",
    "visibility": "public",
    "developer": "_Meta",
    "area": "Index",
    "project": "Repos",
    "family": "Master",
    "description": "The index of every repository this account owns.",
    "doc": "_git-repos-master is the only repo of the account with no entry here. It is the index; an entry would give it a symlink to its own parent directory, which is a loop, not information."
  },
  "tree": [
    {
      "code": "1",
      "kind": "area",
      "name": "Unix",
      "label": "Unix",
      "icon": "🐧",
      "banner": "cloud.gif",
      "developer": "Leaf.y",
      "description": "The Unix estate: the cloudy fleet and the owner's personal cloud.",
      "children": [
        {
          "code": "1.1",
          "kind": "project",
          "name": "Cloudy",
          "label": "Cloudy",
          "icon": "☁️",
          "description": "The cloudy project: fleet infrastructure, services, devices, data and docs.",
          "hub": {
            "code": "1.1.0",
            "kind": "hub",
            "name": "cloudy-___",
            "label": "cloudy-___",
            "visibility": "public",
            "description": "",
            "group": "a_cloud",
            "renamed_from": [
              "cloud",
              "cloud___",
              "cloud-___"
            ],
            "doc": "Project master for the cloud project: a repos.json subset of this file plus committed symlinks. Had a symlink here but no entry until 2026-08-20 — the drift that made `ls a_cloud/` disagree with `--list`."
          },
          "farm": "1.1.Cloudy",
          "children": [
            {
              "code": "1.1.1",
              "kind": "family",
              "name": "Android",
              "label": "Android",
              "description": "",
              "children": [
                {
                  "code": "1.1.1.1",
                  "kind": "repo",
                  "name": "cloudy-u-android",
                  "label": "cloudy-u-android",
                  "visibility": "public",
                  "description": "Android Parallel Space / Virtual Engine — data-ownership workspace built on the cloud/ declarative framework",
                  "group": "a_cloud",
                  "renamed_from": [
                    "cloud-u-android"
                  ],
                  "doc": "Android client."
                }
              ]
            },
            {
              "code": "1.1.2",
              "kind": "family",
              "name": "C3",
              "label": "C3",
              "description": "Fleet infra and containers.",
              "children": [
                {
                  "code": "1.1.2.1",
                  "kind": "repo",
                  "name": "cloudy-t-infra",
                  "label": "cloudy-t-infra",
                  "visibility": "public",
                  "description": "what happens if a Penguin learns  how to surf?",
                  "group": "a_cloud",
                  "renamed_from": [
                    "cloud-infra",
                    "cloud-t-infra"
                  ],
                  "doc": "Fleet: services, infra, the derive engine (1_cloud-configs). Renamed from cloud-infra 2026-10-23 (#1136)."
                },
                {
                  "code": "1.1.2.2",
                  "kind": "repo",
                  "name": "cloudy-u-containers",
                  "label": "cloudy-u-containers",
                  "visibility": "public",
                  "description": "Container service definitions for the cloud fleet (split from cloud-infra/a_solutions)",
                  "group": "a_cloud",
                  "renamed_from": [
                    "cloud-u-containers"
                  ],
                  "doc": "The containerised services a_solutions ships: one dir per service, each with build.json. Mounted back into cloud-infra as a submodule at a_solutions/ so the ship engine keeps globbing a_solutions/*/build.json."
                },
                {
                  "code": "1.1.2.3",
                  "kind": "repo",
                  "name": "cloudy-u-containers_cgc",
                  "label": "cloudy-u-containers_cgc",
                  "visibility": "public",
                  "description": "Public half of the cgc code knowledge graph pipeline: octocode indexes of the public repos -> GHCR -> cloud-cgc-pub-mcp. Split out of cloud-u-containers / cloud-infra.",
                  "group": "a_cloud",
                  "renamed_from": [
                    "cloud-u-containers_cgc"
                  ],
                  "doc": "The PUBLIC cgc code-knowledge-graph pipeline (pub surface: octocode indexes of the public repos -> GHCR -> cloud-cgc-pub-mcp), split out of cloudy-u-containers / cloud-infra; split-outs are named <parent>_<name>. Holds the pipeline code and the reusable cgc-db-index.yml the private half calls by sha."
                }
              ]
            },
            {
              "code": "1.1.3",
              "kind": "family",
              "name": "DB",
              "label": "DB",
              "description": "Data repos.",
              "children": [
                {
                  "code": "1.1.3.1",
                  "kind": "repo",
                  "name": "cloudy_db_assets-cdn",
                  "label": "cloudy_db_assets-cdn",
                  "visibility": "public",
                  "description": "",
                  "group": "b_projects",
                  "renamed_from": [
                    "front-assets-cdn",
                    "cloud_db_assets-cdn"
                  ],
                  "doc": "Static assets served from the CDN. Renamed from front-assets-cdn 2026-10-27 (#1217)."
                },
                {
                  "code": "1.1.3.2",
                  "kind": "repo",
                  "name": "cloudy_db_infra-ops-obsv_configs-sync",
                  "label": "cloudy_db_infra-ops-obsv_configs-sync",
                  "visibility": "public",
                  "description": "Configs-sync engine data repo: consolidated fleet config SoT (from 1_cloud-configs) served by c3-infra-api/mcp",
                  "group": "a_cloud",
                  "renamed_from": [
                    "cloud_db_infra-ops-obsv_configs-sync"
                  ],
                  "doc": "Configs-sync engine data repo: the consolidated fleet config SoT (from 1_cloud-configs) served by c3-infra-api/mcp. Created 2026-10-25 (#1197 programme); public."
                },
                {
                  "code": "1.1.3.3",
                  "kind": "repo",
                  "name": "cloudy_db_LFS",
                  "label": "cloudy_db_LFS",
                  "visibility": "private",
                  "description": "Cloud data storage using Git LFS",
                  "group": "a_cloud",
                  "lfs": true,
                  "renamed_from": [
                    "cloud-data-lfs",
                    "cloud_db_LFS"
                  ],
                  "doc": "Large binary artefacts (git-lfs) for cloud-me-pvt-data (was cloud-data)."
                }
              ]
            },
            {
              "code": "1.1.4",
              "kind": "family",
              "name": "Desktop",
              "label": "Desktop",
              "description": "",
              "children": [
                {
                  "code": "1.1.4.1",
                  "kind": "repo",
                  "name": "cloudy-u-desktop",
                  "label": "cloudy-u-desktop",
                  "visibility": "public",
                  "description": "penguins does have wings, but those are divers and swimmers!",
                  "group": "a_cloud",
                  "renamed_from": [
                    "cloud-infra-desktop",
                    "cloud-u-desktop"
                  ],
                  "doc": "Workstation + device configuration, nix flakes, the superapp. Holds the Claude SoT (da_my-ai/src/data/claude)."
                }
              ]
            },
            {
              "code": "1.1.5",
              "kind": "family",
              "name": "Docs",
              "label": "Docs",
              "description": "",
              "children": [
                {
                  "code": "1.1.5.1",
                  "kind": "repo",
                  "name": "cloudy-a-docs",
                  "label": "cloudy-a-docs",
                  "visibility": "private",
                  "description": "Cloud docs: RoadMap, Backlog (p-backlog) and Architecture, split out of cloud-me-my-ai",
                  "role": "backlog",
                  "group": "a_cloud",
                  "renamed_from": [